{
  "videoDetails": {
    "videoId": "dQw4w9WgXcQ",
    "title": "Rick Astley - Never Gonna Give You Up (Official Music Video)",
    "isLive": false,
    "isPrivate": false,
    "audioLanguage": "en",
    "thumbnail": {
      "thumbnails": [
        { "url": "https://i.ytimg.com/vi/dQw4w9WgXcQ/mqdefault.jpg", "width": 320, "height": 180 },
        { "url": "https://i.ytimg.com/vi/dQw4w9WgXcQ/hqdefault.jpg", "width": 480, "height": 360 },
        { "url": "https://i.ytimg.com/vi/dQw4w9WgXcQ/maxresdefault.jpg", "width": 1280, "height": 720 }
      ]
    }
  },
  "playabilityStatus": { "status": "OK" },
  "streamingData": {
    "adaptiveFormats": [
      {
        "itag": 137,
        "mimeType": "video/mp4; codecs=\"avc1.640028\"",
        "bitrate": 4500000,
        "width": 1920,
        "height": 1080,
        "fps": 30,
        "contentLength": "95000000",
        "url": "https://rr3---sn-synthetic.googlevideo.com/videoplayback?expire=9999999999&itag=137&signature=synthetic"
      },
      {
        "itag": 136,
        "mimeType": "video/mp4; codecs=\"avc1.4d401f\"",
        "bitrate": 2500000,
        "width": 1280,
        "height": 720,
        "fps": 30,
        "contentLength": "48000000",
        "url": "https://rr3---sn-synthetic.googlevideo.com/videoplayback?expire=9999999999&itag=136&signature=synthetic"
      },
      {
        "itag": 140,
        "mimeType": "audio/mp4; codecs=\"mp4a.40.2\"",
        "bitrate": 130000,
        "audioSampleRate": "44100",
        "contentLength": "5000000",
        "url": "https://rr3---sn-synthetic.googlevideo.com/videoplayback?expire=9999999999&itag=140&signature=synthetic"
      }
    ]
  },
  "captions": {
    "playerCaptionsTracklistRenderer": {
      "captionTracks": [
        {
          "baseUrl": "https://www.youtube.com/api/timedtext?v=dQw4w9WgXcQ&lang=en",
          "languageCode": "en",
          "name": { "simpleText": "English" }
        },
        {
          "baseUrl": "https://www.youtube.com/api/timedtext?v=dQw4w9WgXcQ&lang=en&kind=asr",
          "languageCode": "en",
          "kind": "asr",
          "name": { "simpleText": "English (auto-generated)" }
        }
      ]
    }
  }
}
